tweet_bersih,label_sentimen
miris didik jaman penting gadged didik maaf usir tahun sekolah daring memilikihpandroid ampsaat ajar tatap muka memilikiseragamamp lengkap sekolah,0
sekolah offline senang,1
puan syukur indonesia pasuk fase endemi covid kondisi anakanak ajar tatap muka ptm sekolah tenang puan peduli tani,1
saya kerja tutor daring offline musim utbk pasu lobus sekolah orang sepi pasu kadang sereeeet banget,1
christyjkt sekolah offline,1
puan syukur indonesia pasuk fase endemi covid kondisi anakanak ajar tatap muka ptm sekolah tenang puan peduli orang cilik,1
cai bukaaan ulang sore habis sekolah offline,0
efek sekolah tatap muka kali,1
kelas aktif ngekpop kelas wkwk ajar enjoy bina matik ekstra tari aktif banget tampil kayak beban seru mpls pta mopks latih paskib sekolah offline fullday minggu car free day,0
puan syukur indonesia pasuk fase endemi covid kondisi anakanak ajar tatap muka ptm sekolah tenang kader partai demokrasi indonesia juang puan,1
sekolah offline,0
kita usaha streaming kayak paksa peringkat sekolah tatap muka uji kerja full wfo peringkat turun moga semangat myyy,0
offline nder kemarin sekolah banget anak orang tua sekolah tapiiii deng,1
puan syukur indonesia pasuk fase endemi covid kondisi anakanak ajar tatap muka ptm sekolah tenang kader partai demokrasi indonesia juang puan,1
puan syukur indonesia pasuk fase endemi covid kondisi anakanak ajar tatap muka ptm sekolah tenang puan pm,1
ily samaaa pas sekolah offline,1
instansi didik indonesia aktiv ajar sekolah offline sepatu barugirls langsung cek linknya,1
christyjkt cieee sekolah offline semangat lupa sarap,1
saya rasa sekolah offline eh kopit sekolah rumah pas lulus kangen jaman sekolah rasa doang sekolah offline,1
rl guru sekolah offline kasih alas,0
pokok pas pandemi kuliah sekolah offline sibuk tugas kakak sekolah offline anak kerjain tugas guru lempar buku kata ejek menang anjing,-1
hows your day tementemen alhamdulillah sekolah tertawa hihi rate tugas pusing oke i enjoy the process minggu pat offline sekolah metode daring handphone semangat all,1
army lini sepi heboh heboh karantina kerja sekolah les offline seperti but bts army still the nguasain tren chart favorit huhu salty iya,1
ayo absen sibuk batukpilek bapil serang suami huhu bapil musim bu oleholeh libur kemarin tambah anak aktif sekolah tatap muka,-1
saya kaget banget pas sekolah offline tingkat kemarin dekel canda teman saya teman twerking muka saya saya duduk lantai,0
sekolah kota madiun buka ppdb offline,0
did great for this monday yel lupa istirahat minum vitamin kuliahsekolah offline yorobun,1
rilll coy semenjak sekolah tatap muka cepat antuk,-1
puan syukur indonesia pasuk fase endemi covid kondisi anakanak ajar tatap muka ptm sekolah tenang puan pm,1
konspirasi weh habis covid terbit cacar monyet gejala huhu sekolah offline weh capek banget kenal teman pokok mesti stay aman teman teman,-1
christyjkt seru adik semangat sekolah offline dedek,1
semenjak sekolah full day offline nge fangirl,-1
lihat orang wisuda offline seru sekolah,0
informasi jual flashdisk sandisk gb harga pasar kamu cocok wfo sekolahkuliah offline sila beli shopee sedia shopee,0
saya kampung terang anak masuk sekolah tatap muka smester saya tokoh orang udik suka pikir kritis,0
srkng fokus script isiny revisi revisi revisi ayo doa moga besok revisi amin soalny sekolah jam offline anjrtt aaa habis santai sebentar main game jam ngeberesin jurnal script,-1
laksana lomba hardiknas luring tatap muka sekolah cinta kasih tzu chi lomba cerdas cermat debat nyanyi,0
recap like i said about days ago saya konten study progress and here it is saya sekolah offline sore langsung pergi sb homework saya numpukk anw bahagia satnight and rest well lt,1
ppkm level jabodetabek terap ajar tatap muka sekolah,1
selesai pat kemarin jumat masuk saya susul susul matematika besok jam pagi sekolah offline doa moga susah,1
dungakno mben sekolah offline e lancarseger waras,1
brain academy semester ajar mipa ajar sekolah pas semester intensif utbk ajar soshum brain academy offline nder les offline ruangguru detail direct message,0
maaf curhat base bingung cerita anw uji offline sekolah,-1
kakak sedih banget jujur kangen banget sekolah offline on twit mingdeo uji naik kelas huhuhuh tt,-1
gara masuk offline saya puas oi sekolah saya pakai seragam saya ajar rasa pas saya modusin crush saya art show jabajo,1
hai teman teman sekolah offline tugas banget tawar jasa joki tugas tawar pilih joki ringan tugas temanteman banget sila kunjung website,-1
semangat sekolah offline adik christyjkt,1
iya semenjak covid turun hilang anak sekolah masuk offline jalan macet,-1
satusatunya sekolah jenjang smasmk pakai skema offline,1
sekolah offline semangat sekolah toy christyjkt,1
asli beli offline tagih banget ngoleksi kesal jaman sekolah nemunya,0
gays cari tiket im day vip harga sesuai web rupiah tiket jual kabar ajar sekolah ku suruh masuk offline cari tiket direct message terima kasih,-1
dear kak min twit mohon informasi beli tas sekolah anakanak offline,0
jual telepon genggam laptop sekolah offline,1
sistem cbt pakai wifi lokal sekolah wifi buka web kecuali web uji kayak offline,0
sekolah ajar pmp mbok ngapunten asuh keluarga offline mata ajar sekolah mbok,0
masuk sekolah uji semester offline,-1
ajar sekolah cari anak ajar pas sekolah offline pas uji usir,-1
ingin kemarin sekolah offline jam,1
dijuaaaaal sepatu ventela kalau black cocok rekomendasi kuliah offline sekolah offline shopeee ygy,0
sekolah laku ajar tatap muka ptm murid ajar jarak hybrid cips survei orang tua murid kait bijak didik pandemi,1
saya masuk sekolah offline ajar kayak saya pintar erti materi kayak anjing saya pintar,1
gelar serentak disdik gowa pantau uji sekolah tatap muka,1
christyjkt cieee sekolah offline semangat sekolah offline christy,1
nyaman banget onljne sekolah offline april kayak ampun kuat tsay daring,-1
sekolah offline capek senang jalaninnya makan cilok kuah tonton anime favorit kak ayo coba cilok kuah rumah wkwk dunia tt,1
puan syukur indonesia pasuk fase endemi covid kondisi anakanak ajar tatap muka ptm sekolah tenang puan peduli orang cilik,1
puan syukur indonesia pasuk fase endemi covid kondisi anakanak ajar tatap muka ptm sekolah tenang kader partai demokrasi indonesia juang puan,1
puan syukur indonesia pasuk fase endemi covid kondisi anakanak ajar tatap muka ptm sekolah tenang puan peduli tani,1
alhamdulillah anak semangat sekolah new normal pagi tawar daring offline pilih offline semangat turun kasih pilih henti sekolah pindah sekolah sekolah,1
uji kayak uasuts offline sontek kayak jaman sekolah salty,0
campur neng contoh ketemu crush sekolah jiakh tegang contoh ulang offline sedih contoh pas ulang sadar materi masuk alias anjing banget saya bodoh banget loh stres contoh pikir mana habis,0
buibuk grup kelas pas umum ajar sekolah full offline,1
ikut jam sekolah offline kak,0
dipikirpikir agenda ajar sekolah ajar les private teliti dosen tim akreditasi nasional internasional program kreativitas mahasiswa dana agenda program kerja offline himpun kuliah cium baubau offline,0
offline sekolah pakai kertas bawa handphone kesal,-1
ajar tatap muka ptm jalan ayah bunda sehat fisik mental sekolah yuk diskusi sehat anak ptm citra amelinda sp a instagram live besok catat,1
i did it habis sekolah daring benar mudah sekolah dasar peringkat rendah gara gara sekolah offline ancam kelas,-1
sekolah offline libur besok libur weg,-1
jujur semenjak saya sekolah tatap muka saya senang sekolah direct message jarang banget jam kosong mata ajar jurus neranginnya saya paham,1
puan syukur indonesia pasuk fase endemi covid kondisi anakanak ajar tatap muka ptm sekolah tenang puan peduli orang cilik,1
gapaoa sekolah offline rajin,1
sekolah tatap muka pas anak seru teman guru eh kelas salut banget guru tk hebat cipta bonding murid banyak daring,1
ri pas surat pemberitahuan tahun menteri bijak buka kelas atur pemkabpemkot terap mll disdik sekolah coba bicara sekolah pertengahanakhir ofline prokes moga offline senang,1
enak offline materi lumayan erti capek banget pulang sekolah,1
christyjkt pagi semangat todayy semangat sekolah offline,1
christyjkt semangat sekolah offline,1
anak sekolah saya rasa hikmah ajar tatap muka kang jajan the perks of rumah samping sekolah wkwk,1
sekolah saya ulang offline,0
eh kemarin pas sekolah offline pas pulang langsung kapar tidur libur kerja tonton doang deh,-1
puan syukur indonesia pasuk fase endemi covid kondisi anakanak ajar tatap muka ptm sekolah tenang puan solusi bangsa,1
circle sekolah offline full day tidur siang minum kopi habis isya tidur bangun produktif sekolah dasar,1
kasihan sekolah offline ngabisin media sosial yajadinya parah nyontoh baik,-1
puan syukur indonesia pasuk fase endemi covid kondisi anakanak ajar tatap muka ptm sekolah tenang puan peduli orang cilik,1
offlineeeee xx selasa sekolah offline,0
pagi rek barangkali teman sekolah cari bimbel siap ajar banget jadi brain academy offline opsi informasi harga matursuwunn,0
salah satu offline sekolahkursus,1
tidur besok sekolah offline by the way maaf twitan ku galau brutal hujat kakak,-1
efek sekolah kuliah daring orientasi studi kenal kampus kena orientasi studi kenal kampus ajar sopan santun etika tatap muka,1
sekolahkuliahkerja offline butuh banget flashdisk flashdisk sandisk gb new ke harga pasar ke kamu langsung co syopi jb,0
christyjkt sekolah offline semangat nona,1
puan syukur indonesia pasuk fase endemi covid kondisi anakanak ajar tatap muka ptm sekolah tenang puan peduli tani,1
puan syukur indonesia pasuk fase endemi covid kondisi anakanak ajar tatap muka ptm sekolah tenang puan peduli tani,1
oemji notice iya kemarin overwhelmed rl jarang buka telepon genggam sekolah ajar uji wkwwkkw uji offline takut,-1
puan syukur indonesia pasuk fase endemi covid kondisi anakanak ajar tatap muka ptm sekolah tenang kader partai demokrasi indonesia juang puan,1
alam sekolah offline kemarin belang hilang semenjak sekolah daring make skinker ksk skinker doangpdhl pas offline pakai sunscreem reapply saran istirahat wakth isoma pakai ulang nder rajin masker,0
kali sekolah offline kelas penuh,1
sekolah semangat kiki wkwk cororong minggu full kuliah offline,1
sumpah sistem sekolah adik saya aneh banget sekolah offline jam jam ajar jam malam kasih tugas uji semester kayak minggu uji semester ajar surat pemberitahuan tahun,-1
libur sekolah offline raya cc,1
sekolah offline malas,-1
pat day offline pakai tablet sekolah doa,1
kontol banget sumpah psbb sekolah offline mei saya menang kejer kamar mandi bekep mulut saya saking mau sekolah enak bicara doang kena mental fuck orang mental mental jajah kayak mmk,-1
tugas offline hardpaper presentasi kayak pas sekolah,0
sekolah saya pat offline kasih orang tab uji wifi kelas coba uji rumah,0
oh my god baca sekolah offlinesampe pat joblo,0
puan syukur indonesia pasuk fase endemi covid kondisi anakanak ajar tatap muka ptm sekolah tenang kader partai demokrasi indonesia juang puan,1
pas sekolah offline minum kopi pas daring jarang minum kopi gampang sakit minum kopi minum kopi perut panas,0
organisasi siswa intrasekolah santai banget divisi ku by the way divisi akademik giat angkat ku hanya sekolah daring offline langsung lengser,0
jual sekolah abang jarang sekolah pandemic semenjak sekolah offline jual muncul,1
tabe cari kakak offline anak sekolah sender lulus tolong rekomennya les makassar lancar,0
sekolah ngotak banget ganti bijak pat offline pergi essay tambah,-1
puan syukur indonesia pasuk fase endemi covid kondisi anakanak ajar tatap muka ptm sekolah tenang puan peduli layan,1
sesal ajar hidup harga sarah terima kasih hidup baik mama jual sarah sekolah offline paham materi bahagia mama juang hidup,1
bocah uji semester offline alias uji sekolahbaik emak anak tekan biasa daring,-1
christyjkt senin jumat sekolah offline tinggal pat daring by the way good luck,1
lupa kerja keras ajar sekolah cetak prestasi and prove your worth kayak full offline seru deh moga rubung orang moga kamu hasil tuju hidup kamu tuju kamu juang,1
puan syukur indonesia pasuk fase endemi covid kondisi anakanak ajar tatap muka ptm sekolah tenang puan peduli orang cilik,1
puan syukur indonesia pasuk fase endemi covid kondisi anakanak ajar tatap muka ptm sekolah tenang kader partai demokrasi indonesia juang puan,1
yoyakarta asa kota ajar banget sekolah offline mwacetttt,1
study twit sepi sekolah offline asa serame pas pandemi,0
kuliah sekolah sem offline lihat send video tiktok context,0
jakarta ppkm level sekolah tatap muka,1
kayak please nyaman sekolah offline ekonomi baik acara tunda gelar orangorang produktif ganggu corona,1
seringgg pas sekolah offline bleaching warna masuk semir hitam now watching sekolah warnain golden brown bleaching,1
pagi adik sulit christyjkt bangun sekolah offline siang semangat inijangan lupa makanminum air bening vitamin syukur doa lancar bahagia monday have a nice day,1
sekolah kuliah kerja daring offline tatap muka moga normal,1
offline kuliah sekolah kerja please pakai masker jaga sehat hepatitis akut,-1
allah sekolah offline tidur,-1
saya sekolah offline pandemi jarang banget mandi pagi mandi magrib pagi sikat gigi cuci muka,0
siang lambat army aktivitas real life kayak kuliah masamasanya uji semester sekolah kerja masuk new normal aktivitas serba offline beda kayak pas dynamite orang butter stay rumah sambi,1
did have more fun me and i was like dgsjdjsj oltlt i answered i had lots of fun just like and she hugged me dhshsj aaaaaaaaaaa bocah cilik benar guru tk sekolah dasar malas sekolah wkwk besok offline pas mama if only saya bolos oltlt,-1
orang sekolah offline aplikasi ajar turun guna,1
sekolah offline anak bahagia les aji les ajar cari informasi pindah domisili step by step alhamdulillah mental anak bahagia suami bahagia,1
mut semenjak adik magang sekolah offline jarang banget tonton netflix,0
kelas kakak perempuan sekolah murid merdeka kelas daring offline bebas kelas tugas,0
besok sekolah offline wml,1
aaaa sekolah offline,-1
menteri sehat konfirmasi hepatitis akut misterius anakanak iring laku ajar tatap muka sekolah orang tua waspada,-1
tuhan anak sekolah uji offline,1
christyjkt pagi christy bangun semangat sekolah offline giat lupa sarap have a nice day gbu,1
cilor suka stm cvd pas cvd mamang pindah mana sekolah offline,0
saya sekolah offline kayak biasa daring adaptasi orang suasana kayak gelisah banget senang banget offline saya saya biasa,1
kemarin pas us offline sekolah mati lowbat saya kaget asa pakai,0
sekolah daring full offline,0
puan syukur indonesia pasuk fase endemi covidrr kondisi anakanak ajar tatap muka ptm sekolah tenang kader partai demokrasi indonesia juang puan,1
alhamdulillah sekolah bestie sekolah dasar kenal kakel organisasi luardalam sekolah kembang daring class sesi offline classdan circle super baiktapi part gaenaknya,0
wkwk rewel banget lulur gara gara badan keling semenjak sekolah offline,-1
hlo pm bludak kirab iya jathilan iya ono sekolah tatap muka iya uwes wisata iya ramai pokok sing ramai ini uwes geri bal balane ayo ayo,1
ketemu orang seru refreshing sekolah offline draining pas sekolah daring jenuh ketemu orang,1
sekolah uji offline sekolah ku uji daring,0
gubernur jawa timur sekolah temu tatap muka ptm tonton tanding olahraga persen vaksin penuh,1
besok saya ulang sekolah anjjr offline aduh,-1
ih saya sekolah offline gelang allobank saya copot minggu,0
sekolah daring offline,0
buset ribet kayak sekolah offline,0
sekolah tengah juru cari informasi freelance keponakan kasihan sekolah tatap muka kasih uang jajan orang tua,-1
christyjkt waahhh asikk sekolah offline normal gudluckk kristii,1
kamu tinggal minggu kuliah offline tinggal minggu kuliah offline jumat koo teman jumat gaya sekolah pakai training kampus ganti baju dekat sekali,0
transisi sekolah daring sekolah offline,0
murid giat ajar ajar tahun pas tatap muka tahap hadir seragam komunikasi arah guru wali murid siswa kondisi sekolah bantu,0
puan syukur indonesia pasuk fase endemi covid kondisi anakanak ajar tatap muka ptm sekolah tenang kader partai demokrasi indonesia juang puan,1
fightingg by the way pulang jam sekolah offline,0
anakanak ajar tatap muka sekolah tenang ringan beban anak orang tua jalan ajar jarak ajar jarak jauh puan solusi bangsa,1
asheljkt sekolah offline habis uji,1
terima sekolah pkknya offline pakai handphone sekolah saya pakai kertas moga,-1
kabarnyaa pas offline anak jemput guru buku pulang antar gadiginiin anak sekolah gila salut banget jarang guru jaman benerbener perhati masyaallah,1
nyatet weh kelas kayak rajin nyatet semenjak pandemi jarang banget pas kelas catat pas sekolah offline,-1
anakanak adik sekolah offline tolong diberitau lupa pakai masker,1
halo sekolah kuliah offline daring,0
allah sekolah offline,1
puan syukur indonesia pasuk fase endemi covid kondisi anakanak ajar tatap muka ptm sekolah tenang puan peduli tani,1
usaha nder album rl army beda masuk sekolah offline semangat streaming,0
jaman offline joki tugas ramai bingung banget anggur agustus kuliah pasu lulus alias sekolah,0
sapa sekolahkerja offline anya yuri tugas selamat dunia satu dunia kakak tonton spyxfamily ott sayang bstationcpsushirollnetflixiqiyividioviuwetvdisney famili,0
puan syukur indonesia pasuk fase endemi covid kondisi anakanak ajar tatap muka ptm sekolah tenang kader partai demokrasi indonesia juang puan,1
offline sekolah by the way,0
adik anak kerabat sekolah rencana les daring offline kabar teman teman tawar tarik,0
banget kuliahsekolah daring kemarin kali kuliah offline badan caaapeeekkkkk banget sobat,-1
tatap muka sekolah kawan kawan,1
saya heran sekolah offline asa banget gilir sekolah daring cepat kayak kemarin,0
kaum lgbt langgar susila salat sembahyang gereja makan sekolah iya pornoaksi pornografi jaja onlineoffline,0
nikennn pas daring zoom ngabisin gb tambah tugas tugas wajar contoh kayak tonton yt gb offline pakai wifi sekolah,1
sekolah dunia pat ajar daring uji offline,0
maksud streamnya tanggal indonesia barat sekolahkuliahkerja offline tonton nderr,1
puan syukur indonesia pasuk fase endemi covid kondisi anakanak ajar tatap muka ptm sekolah tenang puan peduli orang cilik,1
kangen sekolah uang jajan tabung uang jajan kuliah makan laundry offline wkwk,1
pagi adik sulit christyjkt sekolah offline kah daring semangat lupa makan minum air bening vitamin syukur doa lancar apa kerja have a nice day,0
ajar selagi offline sekolah daring saya erti apaapa,1
mpls offline gampang gerbang sekolah lebih baik pagi sksd tebal muka malu lumayan relasi beda kelas pas baris mpls ajak kenal kanankiridepanbelakang,1
ooooo zoom kah sekolah offline,0
barang glama pas offline sekolah daring teman saya allah banget saya saya gasudi kenal teman kirim teman super saya ngenang,1
lelah sekolah tatap muka,-1
b daring ketemu sekolah kelas pas offline lulus sepupu pas b rumah samping,0
sekolah offline daring,0
puan syukur indonesia pasuk fase endemi covid kondisi anakanak ajar tatap muka ptm sekolah tenang puan pm,1
puan syukur indonesia pasuk fase endemi covid kondisi anakanak ajar tatap muka ptm sekolah tenang puan peduli orang cilik,1
anak sekolah offline jalan chaos,-1
sekolah offline kangen daring class,-1
rasa sekolah offline alias daring virtual by the way pacar virtual kabar stuck on progress kisah henti kasih dara yuk request kirim salam,1
sekolah ukknya offline pas sekolah ptmt wkwk kocak,0
sekolah offline rasa kali capek pandemi,-1
sekolah ransel beli inimah offline,0
saya sekolah offline saya hitam banget gila,-1
please ayo saya sekolah rasa pensi offline sekolah sumpah babuin deh,1
besok sekolah keinanti siang gaoffline daring sekolah,0
mutual saya jabodetabek ajak meet up malu ketemu orang saya mutual doang ketemu offline wkwk teman sekolah meet offline bareng,0
harap sekolah tatap muka eh masuk sakit sedihsedihsedih,1
hai teman teman sekolah offline tugas banget tawar jasa joki tugas tawar pilih joki ringan tugas temanteman banget sila kunjung website,-1
isya menang melulu allah besok sekolah offline takut mata sembab plss,-1
saya rumah luang barusan jemput bungsu sekolah minggu jadwal tatap muka jalan pulang bungsu cerita teman pacar ampdia ungkap cowok surat pemberitahuan tahun pilih pacarsuami fokus sekolah,1
wih sekolah minggu sekolah offline,1
puan syukur indonesia pasuk fase endemi covid kondisi anakanak ajar tatap muka ptm sekolah tenang puan pm,1
christyjkt pagi christoy semangat sekolah offline,1
piatu bapak penjara covid sekolah gara gara handphone batas biaya gilir masuk sekolah offline usir guru nada enak rundung tementemennya coba orang susah didik,0
sekolah offline tahun pas kelas pas kelas huffft,0
pikir pikir januari senang sekolah offline februari menang gara gara pilih jurus snm maret menang salah jurus neng terima snm april menang banget urus berkas bolak sekolah,1
nder sok superior saya lebih baik fokus sekolah cari duit titip jual kantin dikerjain offline banyak freelance butuh kartu tanda duduk kena tipu freelance bebas nder semangat nder,0
rekomendadi backpack sekolahkuliah tatap muka kerja berangkat kantor tunjang aktivitas baru simak rekomendasi backpack letsgo,0
daerah istimewa yogyakarta diy menghimbau ajar jalan ajar tatap muka ptm sekolah pakai masker,1
jujur sistem wa notifikasi last seen daring offline etik tekan mati kerja sekolah takut enak mati line semuanha serba wa,0
puan syukur indonesia pasuk fase endemi covid kondisi anakanak ajar tatap muka ptm sekolah tenang kader partai demokrasi indonesia juang puan,1
full offline sore berani minggu uji sekolah pakai handphone,1
saya jawa tepat yoyakarta mudik pulang kampung pas matahari panas lampung matahari lampung benar belang banget saya pakai jilbab sekolah offline sekolah muka saya kena matahari,1
murid kali orang belabelain belikan pakai duit bulan anak kostan alhamdulillah sekolah offline tidak perlu daring allah syukur banget banget banget,1
puan syukur indonesia pasuk fase endemi covid kondisi anakanak ajar tatap muka ptm sekolah tenang puan peduli layan,1
lihat mootsku sekolah offline kangen masamasa sekolah,1
christyjkt pagi semangat sekolah offline sekarangg,1
maaf ngehype kayak jujur hectic banget sekolah offline pulang sore tugas mana ulang ceria seko jujur uras tenaga banget pulang sekolah capek banget,-1
halo moots hra rest sekolah offline ehhehehhehe buyer direct message balas okayay,0
beban tugas ulang offline pulang sekolah capek,-1
sekolah kota madiun buka ppdb offline,0
banget prenly suka curhat crush rl peka suka ramein lini suka galau sibuk tugas suka sekolah offline jamet terlalubestie pirtual saya kangen banget oi direct message an ayo rusuh direct message saya,-1
malam moots izin rest sekolah offline sibuk kangen love,-1
puan syukur indonesia pasuk fase endemi covid kondisi anakanak ajar tatap muka ptm sekolah tenang kader partai demokrasi indonesia juang puan,1
maaf jarang baru sekolah offline fullday capek malemnya nugas pas sekolah au baru ucap terima kasih sabar tunggu baru,-1
pusing banget pikir pat offline sekolah kadang free class kadang materi masuk otak,-1
kesan saya b saya puas rasa sekolah offline,0
puan syukur indonesia pasuk fase endemi covid kondisi anakanak ajar tatap muka ptm sekolah tenang puan pm,1
puan syukur indonesia pasuk fase endemi covid kondisi anakanak ajar tatap muka ptm sekolah tenang puan peduli layan,1
offline sekolah,0
hai bangunn sekolahaku minggu uji naik kelas wehada giat hari mangats giat mangats besok uji susul uji tatap muka weh semangat christyjkt,1
sebentar sender sekolah tatap muka ihiyy tataptatapan kyaaa,1
bayang kuliah sekolah offline pas absen bunyi absen teman teman ilham ragil kurniawan konto lodon bocah cilik mati,1
parah negeri landa pandemi covid surat pertanggungjawaban dana bos sekolah lengkap ajar normal tatap muka sekolah libur bingung kerja inspektorat auditor,0
besok sekolah offline daring,0
sekolah offline,1
christyjkt semangat nona seru sekolah offline,1
saran daring pakai mipy offline go kali offline guru ajar langsung bingung langsung jadwal offline capek tenaga alias butuh tenaga esxtra pulang sekolah les,0
pas kelas posisi suka orang peduli pas kelas ajar jarak jauh peduli pas masuk semester sekolah offline suka suka attitude bahasa krama buagusss banget sopan cont,1
daring guru offline offline sekolah,1
pikir pikir kenal korea pop level puncak level halu down turun level sibuk sekolah offline level lewat,-1
teman teman kejar paket faktor kejar paket tinggal pindah kejar paket sekolah pindah kejar paket ajar onlineoffline kayak sekolah tia,0
iri banget graduation offlineeee sekolah seru banget gradu daring zoom sekolah offline,1
sekolah mangkat kuliah makul offline kerja work from office semester seng accord judul skripsi skripsine jek ono seng revisi sempro pernahe rodo nelongso,1
mashiho yedam proposal organisasi siswa intrasekolah accord dekat sekali banget sekolah saya pat offline ptm minggu kucing saya kayak reog saya duit,-1
ih blok offline malas sekolah,-1
sekolah offline pagi teman bang duduk kalem naro kunci motor tas langsung pergi jajan anak kelas jual suruh kesana,0
puan syukur indonesia pasuk fase endemi covid kondisi anakanak ajar tatap muka ptm sekolah tenang kader partai demokrasi indonesia juang puan,1
puan syukur indonesia pasuk fase endemi covid kondisi anakanak ajar tatap muka ptm sekolah tenang kader partai demokrasi indonesia juang puan,1
bring my niece to last week giat cant believe budak nak habis sekolah menang oke kaklong nak kawin lewls lepas offline concert ibu confirm bising tertawa,0
crush jaman tatap muka banget anak agama anak ilmu tahu alam dinding halang bestieee berangkat sekolah lewat kelas pagi lihat berangkat sekolah kayak allah surga duniaaaa wkwk,1
sekolahsekolah universitasuniversitas boleh ajar tatap muka laksana ajar tatap muka,1
puan syukur indonesia pasuk fase endemi covid kondisi anakanak ajar tatap muka ptm sekolah tenang puan pm,1
outfit of the day sekolah offline jaket varsity sekolah kece habis,1
