tweet_bersih,label_sentimen
anak saya sekolah islam bahagia pas ajar jarak jauh tertawa guru pas ajar jarak jauh pakai headset pakai speaker pas sekolah offline senang dia hafal alquran alhamdulillah bahagia salah pilih sekolah kali situ mah,1
hai teman maaf jarang aktif akun sekolah ku offline sulit banget baru baca,-1
kangen sekolah offline,1
overprotektif anak rumah kumpul lebih baik keluarga bentuk fasisme keluarga anak saudara diizinin orang tua sekolah offline bawa pergi kumpul keluarga,0
not my school paksa offline kena covid lucu banget anjing saya kena gara saya paksa mana sekolah,-1
puan syukur indonesia pasuk fase endemi covid kondisi anakanak ajar tatap muka ptm sekolah tenang kader partai demokrasi indonesia juang puan,1
pas janji mal mal pas habis saya potong rambut kirim f potong rambut eh tau pas sekolah offline f banget f masuk grup chat saya balas,0
konser fiersa sekolah offline bangun ekskul bareng menang lomba bring my back,1
cikarang kabupaten bekas kak sekolah offline sekolah ku doang huhu,1
sekolah jajan sekolah offline enak,0
sekolah offline haruto tukar saya banget,1
adik sekolah offline handphone ku pakai streaming,1
valley pipis xiao saya jaman sekolah daring offline saya goblet anemo substats cdmg crate atk susah,0
kerja sekolah kuliah offline please pakai masker teman jaga sehat hindar sakit hepatitis akut stay aman everyone,-1
hayyy selamat siang sekolah tatap muka,0
jumat kakak sekolah offline pulskol cerita guru mr x banget kemarin salah parent wa saya cerita mr x pas mr x keliling kelas temu murid buku materi penuh coret pas mr x baca suruh murid baca tulis,-1
capek sekolah pulang nenek keluh melulu cepat lancong rumah minimal diklatnya offline kayak,-1
saying good bye offline school minggu beda jalan ramai anakanak berangkat pulang sekolah mari cosplay intel alias ajar strategi jaga aman anak sekolah,0
jujur irie pas sekolah situ pisah offline pamer adkel ku keren banget mentemen,0
bayang sekolah sekolah iseng main mal sekolah tonton pas offline sekolah pulang tidur,-1
jujur pas sekolah teman saya ingat kelas kelas offline saya nugas berangkat,0
saya banget efek tatap muka deh sekolah degdegan sekul,-1
saya alamin saya sesal alam sekolah seru saya offline pandemi seru inti,1
pas corona tidur jelek gara gara sekolah daring sekolah offline bangun pagi tidur jam jam sedih banget hancur,0
asli sbt sepi banget sekolah offline,0
semangat sekolah offline,1
puan syukur indonesia pasuk fase endemi covid kondisi anakanak ajar tatap muka ptm sekolah tenang kader partai demokrasi indonesia juang puan,1
kawan kelas rasa vibes sekolah full offline,1
ptm tatap muka struggle sekolah daring susah kayak ajar jelas guru paham daring offline enak interaksi langsung guru bebas bolakbalik,1
oiyaaa sekolah offlinedaring,0
puan syukur indonesia pasuk fase endemi covid kondisi anakanak ajar tatap muka sekolah tenang puan solusi bangsa,1
puan syukur indonesia pasuk fase endemi covid kondisi anakanak ajar tatap muka ptm sekolah tenang puan peduli orang cilik,1
puan syukur indonesia pasuk fase endemi covid kondisi anakanak ajar tatap muka ptm sekolah tenang puan peduli orang cilik,1
pas sekolah dasar olimpiade ilmu tahu alam lomba tari sekolah aktif pramuka musabaqah tilawatil quran camat pas mayoret pinru pramuka lomba nyanyi tari tilawah futsal cewek sekolah habis offline covid langgan guru buku bolos mata ajar,0
tahu daftar mandiri onlineoffline kasih akun ppdb sekolah daftar,0
manusia erti sekolah lamar pas offline kayak banayk banget memori lovyou oll tunggu undang mas nabi,1
pas bolak kamar mandi perut saya sakit banget saya paksa ulangantrus pas blenger banget beda banget guru pas sekolah offline pencet langsung kabur kamar mandi pas lihat hasil tryt saya,0
saya senang banget sibuk sekolah offline kerkom jajan main,1
ih kangen banget kayak sibuk aktif sekolah offline,-1
puan syukur indonesia pasuk fase endemi covid kondisi anakanak ajar tatap muka ptm sekolah tenang kader partai demokrasi indonesia juang puan,1
bginiandibolehkan sekolah tatap muka gelut kayak ginipengecut gelut lawan daya injak teman banyakklo sndrian lawan kayak,-1
min bantu jual tiket im day vip harga sesuai web rupiah tiket jual kabar ajar sekolah ku suruh masuk offline cari tiket direct message terima kasih,0
bu puan syukur indonesia pasuk fase endemi covid kondisi anakanak ajar tatap muka ptm sekolah tenang,1
christyjkt pagi semangat sekolah offline,1
senin masuk selasa masuk sakit rabu libur kamis sekolah daring jumat masuk offline senin jumat uji naik kelas,0
sekolah tertawa hihi besok pat offline,0
terima kasih sekolah tengah juru teman teman kelaskalian partner ajar baik sekolahwalaupun sekolah offline tahun overall senang banget sihsemoga ketemu baik loff all,1
gueee sekolah offline tugas sekolah full,-1
puan syukur indonesia pasuk fase endemi covid kondisi anakanak ajar tatap muka ptm sekolah tenang puan pm,1
kuota saya sisa gin jam sayang buang banget saya rumah pakai wifi data seluler dinyalain butuh kuota pas sekolah offline,1
disdik jamin ppdb offline wilayah remote area sulawesi selatan jalan profesional dinas didik disdik provinsi sulawesi selatan benar sekolah sulawesi selatan,0
bagus pulang kira malam semangats ajar detoyy christyjkt weh sekolah offline tugas video doa moga besok ledak otak soalny besok mata ajar matematika b ing b ing,0
rumah anggap buruk mental biasa buru buru kekantorkepabriksekolah lambat budaya rumah maklum fisik offline uang tambah uang tambah,1
ciiiee sekolah offline christyjkt semangat today,1
latih daring teman sekolah tatap muka kerja rumah tugas apalan pianika teman vidcall nugas bareng,1
anakanak sekolah kuliah bodoh offline tatap muka sosialisasi praktikum bohong sales vaksin kejar insentif vaksin,1
iya sepi banget sekolah offline,-1
a kencang konsumen atk sekolah kantor mbak butuh pulpen buku tulis fotokopi wfo uji offline,1
handphone saya sakit allah besok saya pat offline sekolah pakai handphone,-1
by the way beli tas ajar sekolah offline rekomendasi indah,1
anak sekolah tatap muka tarik beda anak anak aliyah sekolah tarik coba,1
lebih by the way sekolah kecuali murid masuk tatap muka disekolahsoalnya daerah heran sekolah ecek kondisi anak ajar,0
puan syukur indonesia pasuk fase endemi covid kondisi anakanak ajar tatap muka ptm sekolah tenang puan peduli orang cilik,1
kartu uji harus cetak kartu uji bawa sekolah uji tatap muka skip cetak kartu uji bawa uji,0
puan syukur indonesia pasuk fase endemi covid kondisi anakanak ajar tatap muka ptm sekolah tenang kader partai demokrasi indonesia juang puan,1
ppkm level disdikpora diy izin sekolah durasi jam ajar tatap muka,1
sekolah offline nder kemarin sekolah offline,1
puan syukur indonesia pasuk fase endemi covid kondisi anakanak ajar tatap muka ptm sekolah tenang puan peduli tani,1
puan syukur indonesia pasuk fase endemi covid kondisi anakanak ajar tatap muka ptm sekolah tenang puan peduli orang cilik,1
sekolah kantor offline xl fiber tani,0
uji semester offline enak daring malas sekolah etdah,-1
tingkat sekolah kabupaten bandung barat jawa barat laksana ajar tatap muka ptm persen pekan putus iring turun covid,1
wajar edtech goyang sekolah enak tatap muka anakanak alam sosialisasi ganti,1
menang banget sekolah offline ibuk belikan sepatu bismillah bunaa moga rezeki huhu sehat lancar rezekinyaa bunaa luv,-1
sekolah offline potensi drop anjing makan mie hari x jajan sembarang nugas pagi pagi minggu pat materi tanggungtanggung,-1
offline sekolah offline gradu,1
pas rumah sekolah offline buka pas pulangitupun sebentar weekday coba sibuk sentuh rumput nder,0
plshhh oi saya hari dengar glitch mode besok sekolah offline eh teman saya rusak dengar saya kayak,-1
orang lupa turun gara gara kali uji rumah saya jujur teman teman saya cari google nilai drastis sedangkannilai saya kayak pas uji offline sekolah,0
puan syukur indonesia pasuk fase endemi covid kondisi anakanak ajar tatap muka ptm sekolah tenang puan peduli tani,1
puan syukur indonesia pasuk fase endemi covid kondisi anakanak ajar tatap muka ptm sekolah tenang kader partai demokrasi indonesia juang puan,1
oh banget ngandelin bimbel daring murahzenius pahamify bantu tryout materi gituuuu saran bimbel offline simpul les bagi wajib materi sekolah ajar minimal bimbel daring,0
tes dipilihin tempat nder kampus sekolah tes offline,0
sekolah offline enak jual sekolah nder siga saya bareto jaman sakola bari jual goreng sapoe beresih meunang nepi kakak ke lumayan jang jajan,1
iya terima kasih riee hoalah enak daring rindu sekolah offline capek iya besok jepit libur,-1
puan syukur indonesia pasuk fase endemi covid kondisi anakanak ajar tatap muka ptm sekolah tenang puan peduli orang cilik,1
mandu artku belanja bahan sekolah offline bangun siang tidur malam bangun pagi,0
moga terima sekolah pilih,0
cant agree more saya jebol negeri seleksi masuk guru negeri matdas latih boroboro materi sekolah seleksi masuk guru negeri subscribe zenius bimbel offline to matdas konsisten,0
halo kakak sekolah ada pensi offline tanggal juni gs tulus kak minat direct message kak,1
hai moots maaf banget jarang updateee sekolah offline soalnyaaa jarang buka twitter,-1
offline oke handphone teman liat lihat wa teman banget sekolah offline ulang pakai handphone,-1
kondisi anakanak ajar tatap muka sekolah tenang puan solusi bangsa,1
alhamdulillah sekolah anak laku ptm alias ajar tatap muka,1
saya lupa banget sekolah offline and genuinely shocked lihat mana kayak kamu sekolah masuk offline kamu jam gin pulang kamu cafe isi anak sekolah saya wgwgwg,0
believe it orang not bm bakpao hijau gara gara sekolah daring offline eh jual kayak jajan wajib kantin sekolah,0
kangen banget apa mandi dress upmake uptipis tipisparfume botol sekolah hiks hiks pas kuliah offline oh no saya takut,-1
besok isi borang baca kayak sekolah ajar baca baca offline daring indonesia bisa isi borang kayak salah banget by the way soodam cantik banget number,0
puan syukur indonesia pasuk fase endemi covid kondisi anakanak ajar tatap muka ptm sekolah tenang kader partai demokrasi indonesia juang puan,1
covid landai sekolah ajar tatap muka,1
offline udahann kerja kerja guru kantin sekolah,-1
jujur hutang puasa ku anjing besok sekolah offline kagok gas besok uji iman lihat jajan sekolah,0
fyp sliweran sekolah sekolah giat offline kayak classmeet senang iri,1
saya sekolah offline ongkos keluh bingung banget bayar anjing tertawa ayo ayo wto wto album bloom,-1
bayang kelas bego eh kelas bego matematika gara guru tambah murid malas mencary jelas yt sekolah offline anjing,-1
sekolah daring pengumuaman uji offline seram,-1
minggu offline saya ngebiasain interact anakanak sekolah saya anak kelas saya obrol cowok ruang pat,1
puan syukur indonesia pasuk fase endemi covid kondisi anakanak ajar tatap muka ptm sekolah tenang puan peduli orang cilik,1
puan syukur indonesia pasuk fase endemi covid kondisi anakanak ajar tatap muka ptm sekolah tenang puan peduli orang cilik,1
sekolah full offline parkir disebelahju ketemu dia senyum,1
puan syukur indonesia pasuk fase endemi covid kondisi anakanak ajar tatap muka ptm sekolah tenang puan peduli layan,1
atur tempat toba sekolah lokasi asing nostalgia sekolah semester offline,0
oknum kayak makan ajar bimbel banding sekolah platform ajar onlineoffline ramai banget salah satu kasihan gamampu les peer to peer nyampeinnya salah tangkap,0
geming efek sekolah offline,0
sekolah full offline,0
wenny ariani sebut anak ikut ajar tatap muka ptm kasus simak video,-1
banget sekolah offline,-1
puan syukur indonesia pasuk fase endemi coggvid kondisi anakanak ajar tatap muka ptm sekolah tenang kader partai demokrasi indonesia juang puan,1
sekolah offline seru,1
