tweet_bersih,label_sentimen
jualann kayak makan makan ringan kayak cimol piscok offline lumayan lihat teman laku daerah nyesuain jajan cocok sekolah,0
nightmare anjing deh tolong sekolah tatap muka buka kantin sekolah kereta swab mauuhiling,1
sekolah solusi telepon genggam jadwal tatap muka murid fasilitas telepon genggam contoh desadesa telepon genggam orang tua kunjung guru prokes,1
semenjak sekolah offline tidur siang harga,1
rekan buana sadar jalan penuh rekan buana kendara pribadi transportasi anak sekolah ajar offline flashback rara caca,1
seru giat untung pas kelas rasa sekolah offline semester wisuda acara pensi seru banget covid huhu,1
daring offline sekolah kuliah,0
changkyun stan giat ajar ajar tatap muka moga surup tempel jin sekolah,-1
sekolah besok upacara offlineonline,0
ajar besok tanggal pat offline sekolah,1
puan syukur indonesia pasuk fase endemi covid kondisi anakanak ajar tatap muka ptm sekolah tenang puan peduli orang cilik,1
sekolah wisuda nder daring offline,0
kerja sekolah kuliah offline lupa pakai masker,1
protokol sehat prokes laksana ajar tatap muka ptm penuh sekolah kota mataram,1
offline daring wkwk sekolah pakai handphone,0
eh sekolah offline,1
sekolah offline uji doang,1
huhu makasii semangat yobien takut banget besok uji naik offline sekolah uji daring,-1
kantin sekolah pas offline jual sekolah dibolehin mama sekolah kantin tutup c word,0
paksa pakjangan rakyat uber kerumahdirazia dijalanananak buru seko intimidasi gurudiancam sekolah tatap muka dllyg sehat vaksin sila sehat alami paksa,-1
puan syukur indonesia pasuk fase endemi covid kondisi anakanak ajar tatap muka ptm sekolah tenang kader partai demokrasi indonesia juang puan,1
christyjkt open joki sekolah offline direct message,0
nder lingkung gaul cari hshsh seru sekolah offline,1
aroma anak sekolah offline deh,-1
libur semester anak sekolah offline,1
good night christyjkt rest well besok senin maksud bangun pagi sekolah offline upacara wkwk selamat tidur,1
tokbuk langgan beli daring offline kesana beli buku sekolah,0
puan syukur indonesia pasuk fase endemi covid kondisi anakanak ajar tatap muka ptm sekolah tenang puan peduli orang cilik,1
hai teman teman sekolah offline tugas banget tawar jasa joki tugas tawar pilih joki ringan tugas temanteman banget sila kunjung website,-1
us kemarin pakai kertas uji offline kali sekian orang paham sekolah offline sem ptm alhasil paham bukti raport sem tinggi wkwk,1
anjink murid butuh perhati khusus sekolah offline bye,-1
tertawa anjing cokkk semenjak sekolah kuliah masuk full tatap muka solo macettt anjing kali malam minggu macet cokk niat pasar malam kira macet pas masuk gerbang kraton macet situ serah,-1
banget gara gara pandemi seperti uji coba takutt banget berangkat keringet dingin daring masuk sekolah offline kambuh panik sekolah,-1
tahu ppg prajabatan sistem kuliah offline bentrok jam jam ajar sekolah,-1
iyapp smstr offline sekolah ruang kelas tingkat lanjut tingkat bangku kuliahh luluss deh kykk kemarin hibernasi besok kelulus,1
turut tugas sekolah daring deh asa banding offline sekolah aneh,-1
i feel nderr sahabat niatin sekolah ilmuu nilai tinggal usaha bisa doaa biasa uji offline pas kuliah nyontekk berkah nilainyaa,1
iya pas antar anak sekolah offline menang jalan,-1
pagi mas al azhar masuk sekolah offline muaceeeet pol,-1
pat offline kh pakai kertas daring sekolah,0
puan syukur indonesia pasuk fase endemi covid kondisi anakanak ajar tatap muka ptm sekolah tenang puan peduli tani,1
iya bawa anw kelas huhu semangat sekolah offline wkwk,1
saya sekolah offline rasa nama sekolah,1
moots doa bisr besok bstuk flu ku hilang rabu sekolah offline,1
bayang sekolah daring tb tb patnya offline alias ngang ngong ngang ngong,-1
dindik kota madiun izin sekolah buka ppdb offline,1
sekolah daring dengar pas offline,0
ala bongkar identitas acil ah daring malas banget sekolah maaf sekolah offline ltlt sedih banget graduation pas pandemi farewell suka pergi kota,1
butuh kelas buku utbk les onlineoffline try out yearbook purnawiyata bebas gantung sekolah masingmasing,0
samping produkproduk usaha muslim pamer informasi sekolah sunnah talkshow bedah buku sayang hadir pamer buka daftar offline,0
puan syukur indonesia pasuk fase endemi covid kondisi anakanak ajar tatap muka ptm sekolah tenang puan peduli orang cilik,1
iyhhh kayak ribet offline pas sekolah hitung daring semester full off wkwk,0
stres stres gila wkwk capek capek sekolah offline pulang langsung bimbel utbk jalan oh kelas kejut duga seru xixi,-1
profesional sekolah tatap muka covid marak beda dapat maki anak orang bego,-1
nderr ajar rasa koo pat offline ajar lihat hasil alhamdulillah syukur banget mampu ku manfaat banget sekolah ilmu,1
semenjak sekolah offline maaf kasih saran atas,0
negeri sulawesi selatan ppdb offline,1
sekolah full offline ramai banget jalan,-1
daring sekolah tatap muka eh pas bijak tatap muka daring,0
sekolah offline guru bimbel bingung sesuai jadwal banyak les bimbel sang anak wkwk,-1
kangen sekolah pas pandemi kangen pas sekolah offline,1
beli laptop laptop pakai make laptop jarang semester sekolah offline,0
masuk kuliah offline alam masuk sekolah menit henti jalan perut kram kepala putar diterusin jalan takut tabrak jatuh malu,0
pagi sekolah offlinegt,1
bebas buka masker sepi sekolah offline eh,1
sekolah enak banget anjing uji offline pakai hplaptop saya pakai kertas tt,-1
puan syukur indonesia pasuk fase endemi covid kondisi anakanak ajar tatap muka ptm sekolah tenang kader partai demokrasi indonesia juang puan,1
uji and actually not bad takut uji offline sekolah uji sekolah ngerjainnya pakai gform but remember kakak reggie said pana enteng if im not salah,-1
pandemi endemi pagi aktivitas mulia jam pagi lalulalang kendara ajar sekolah antar orang tua motor sekolah tatap muka buka,1
good pagi on this foggy monday pagi christyjkt semangat sekolah offline main handphone kelas sita,1
sekolah offline anak bolos nature is healing,-1
galau gara dreamies pakai acara sekolah senin offline,-1
terima kasih fotonnyaaa sekolah offline semangat christyjkt,1
sekolah offline tta teror teror seru banget gilakkk moots hilang,0
enas anjing wkwk saya suka orang kelas lumayan kali pulang bareng kelas daring full kontak kecuali sekolah kerpok diskusi kelas tatap muka batas saya suka,0
mei srp usaha sekolah,0
kayak sekian abad tonton konser offline tonton artefac daring ngegigs offline suara habis kaki saya gemetar wkwkwkwkwkwk partner nsy jaman sekolah goksss wkwk,0
percaya hem pandemi beda sekolah swasta negeri adik swasta pas pandemi zoom pagi sore kelas offline ber pegang guru pas pandemi room zoom isi orang guru kontrol,1
sibuk banget sekolah offline jani offline gaaaa,-1
bayang kelas daring guru ngangong banyak habis gara gara kendala teknis guru njelasin masuk otak kita malesan gara gara kelas jeder offline uji sekolah offline kejar utbk bayang stressnya kayak bgimana,-1
christyjkt sekolah offline selamat sekolah dedek,1
sekolah uji daring besok senin suruh uji offline be like,0
sekolah offline capek aduh,-1
saya seram pas sekolah offline seru,1
akuuuuu skincarean ajar jarak jauh rasa sekolah offline,1
i feel nder hasil bagus sontek percaya deh hasil usaha bangga puas ajar mudahin materi sekolah offline,1
murid saya anak tabur sekolah offline misuh malas gerak tawur raga,-1
totebag muat siap sekolahkuliah offline a thread link,0
puan syukur indonesia pasuk fase endemi covid kondisi anakanak ajar tatap muka ptm sekolah tenang puan peduli orang cilik,1
myslf kadang pas lembur suka pikir tidur wkwk sekolah offline kurang tubuh kayak istirahat begadang kayak hilang,1
eh anak sekolah dasar sekolah offline,1
ajar fisika paham konsep ajar guru sekolah masuk otak besok pat fisika offline no contek contek sender duduk moga lekas sembuh mental sehat sender tolong bingung,-1
sbbb kakak aaaaa thankyouu banget kakak usaha kayak sekolah offline nyaman daring kelulus uji semester kakak semangat,-1
tertawa main pas jaman sekolah offline emosi cndy,0
puan syukur indonesia pasuk fase endemi covid kondisi anakanak ajar tatap muka ptm sekolah tenang kader partai demokrasi indonesia juang puan,1
nak wedhok sumeng pagi suruh sekolah daring offline sekolah teman ulanganaku susul repot oke fine kak langsung dropping sekolah sore kabar nak wedhok goes to dokter,1
ih gapapaa sekolah offline on twit tt mingdep uji naik kelas,-1
kampung oke saya saya renov jarang kampung offline emosi banget pagi ketuk pintu bangun anak sekolah ribut hidup mati lampu tegur fuck,-1
bebas buka masker tempat sepi sekolah offline eh,1
ayo donggg sekolah daring sekolah offline teman gaseruuu banget,-1
puan syukur indonesia pasuk fase endemi covid kondisi anakanak ajar tatap muka ptm sekolah tenang kader partai demokrasi indonesia juang puan,1
anjjj sekolah offline rencana kemarin orang malas,0
aktivitas offline kerja kuliah sekolah banding rumah stream pengaruh capa goals buruk,-1
wow kondisi anakanak ajar tatap muka sekolah tenang ringan beban anak orang tua jalan ajar jarak ajar jarak jauh puan solusi bangsa,1
ily benerrrrrr bongkar rahasia sekolah offline wkwk,0
puan syukur indonesia pasuk fase endemi covid kondisi anakanak ajar tatap muka ptm sekolah tenang puan peduli tani,1
sekolah daring pakai aplikasi offline hadir,0
tambah orang aktif wfo sekolah offline,1
luring offline iya offline sekolah langsung,1
yuhuuuuu episode tonton kamu saudara laki iya alif tracy sharing sekolah onlinedan banding sekolah tatap muka relate banget tonton saudara laki,0
christyjkt enak lebih baik sekolah offline ketimbang sekolah daring,1
percaya senang anak sekolah offline kesal macet dekkkkk pakai helm nungguan teman yaampunnn marah akun pulang kerja capek adik huhu tolong,-1
sekolah offline awal adegan tolong celaka kerja,1
besok st day jenna sekolah offline maknya deg degan jiper,-1
diperlakukanya temu tatap muka seluruh sekolah harap program merdeka ajar jalan,1
wahhhhh stay aman binnnn sekolah jam berapaaa iajdjjas maaf zhei curious zhei offline covid tt,0
sekolah kerja offline,1
puan syukur indonesia pasuk fase endemi covid kondisi anakanak ajar tatap muka ptm sekolah tenang puan peduli tani,1
gapapaaa takut wkwk kali pat offline sekolah seram ajar doa semangaat yaaak,1
emm dif offline pas daring tolong kasih foto teman pas ulang eh kasih donggg guru salah pakai baju sekolah asa kasih pap oi,0
semangat sehat raih mimpi bintang takabur sukses offline school indah sekolah ajar tahu adab,1
christyjkt oi toyy malas banget sekolah offline semangattt,-1
puan syukur indonesia pasuk fase endemi covid kondisi anakanak ajar tatap muka ptm sekolah tenang puan pm,1
acara offline sekolah anak kelas semuaaaaaaaaaaaaaaa,-1
puan syukur indonesia pasuk fase endemi covid kondisi anakanak ajar tatap muka ptm sekolah tenang kader partai demokrasi indonesia juang puan,1
ranah cuti sekolah minggu rakyat malaysia cut belanja offline,0
ukk offline sekolah,0
foto tugas sekolah ketemen kwwk foto papan tulis selagi kelss tatap muka wkwk video kenang sekolah kaliyaa,1
kemarin beli illegal versi aman beli jalur legal mkr urus anak offline masuk sekolah,0
ppdb kota yogyakarta simak jadwal ppdb tk sekolah dasar ppdb yoyakarta offline jalur,0
sekolah offline susah lebih baik jual kitu reseller sekolah,-1
christyjkt anya sekolah offline,1
koko sekolah daring lawan koko razia pas offline,0
pas brangkat sekolah teman jemput arah saya enak kasihan kondisi saya iya mandi anjr tunggu lambat masuk utg coba offline,1
kali coba bangtan sekolah offline,-1
pakai sepatu converse imitasi uang beli beli pas lulus sekolah pakai kuliah pas jaman offline salah semester saya kerja kelompok indekos saya,0
pokok offline biar tenaga saya habis melulu pulang sekolah saya bodoh prokes,1
mpls offline pandemi mpls daring sekolah cari panitia mpls offline panitia mpls yaynay,1
sekolah offline kakak,1
dindik kota madiun izin sekolah buka ppdb offline,1
christyjkt pagi adik semangat sekolah offline,1
hihi maaf off twitter masuk sekolah offline sibuk tenang buka slowresp jam malam fastresp,-1
ayo teman teman kening belang semenjak sekolah offline pakai sunscreen by the way butuh banget nyerahin bb,-1
maaf kelas selsai jam for yearsss sekolah saya pulang jam kurang jam and when yel were sleeping saya selsai sekolah jam andd optimal ajar sunyi fokus dibandingin offline school berisik ramai fokus,-1
kerja sekolah kuliah offline please pakai masker jaga sehat hepatitis akut,-1
kali presentasi tatap muka sekolah daring gilir bicara masker buka jujur saya buka masker kondisi wajah saya bagus saya percaya pas guru saya,-1
puan syukur indonesia pasuk fase endemi covid kondisi anakanak ajar tatap muka ptm sekolah tenang puan peduli tani,1
kayak pas sekolah offline wkwk langsung les capek banget sangka libur karantina,-1
iri banget adik kelas wisuda offline angkat saya cancel anyway selamat adik adik sekolah pandemi susah enak gabutnya wkwk moga lancar studi karirnya lulus sekolah ribet bosss siapppp kwkwkwk,1
ppdb jabar daftar offline sekolah ambil pilih,0
guru matematika pas sekolah offline nerangin materi kelas murid respon,0
kangen banget paraaaaah tt sekolah offline sibuk deh huhu,-1
konspirasi weh habis covid terbit cacar monyet gejala huhu sekolah offline weh capek ngang ngong ngang ngong ett waspada gusy,-1
tertawa onlineoffline sekolah wajar bingung mksndya ajar rumah daring libur,0
syapa bingung takut nilai geblog ulang offline pakai tab sekolah handphonenya kumpul kerja scroll tiktok pikir,-1
kesal gara covid sekolah offline gabung kelas smstr kelas doang fakk nolep,0
mas kayak sekolah tatap muka coroncesss hilang sungjin aiihhh virus cinta ngreog mas,0
puan syukur indonesia pasuk fase endemi covid kondisi anakanak ajar tatap muka ptm sekolah tenang puan solusi bangsa,1
ulang sekolah ramai banget offline,1
bego daftar offline sekolah tuju kasih dokumen persyaratanjalur rapotamp juara bodoh erti,0
kenduri kendara pon sekolah no wonder results spm offline daring harap daring iya takut niii,-1
sekolah resmi ajar tatap muka paham guru asli guru lamakelamaan adaptasi anak senang ajar saya saya banget pas saya resign sedih,1
alhamdulillah kemarin kakak cantik order order harga rbpouch sayang berat gede jual kamu sekrg sekolah tatap muka harga jual beda minimum ordera yuk order momo,0
sekolah tatap muka,1
sekolah offline kayanyaa huhu,-1
lancar seru sekolah offline kangen sekolah bad cepat gede ayanggg hihi enak anak sekolah,1
uang seragam hubcabang offline fasilitas anak ajar suka visi misi anak kembang disamaratakan mampu sekolah sulung,1
puan syukur indonesia pasuk fase endemi covid kondisi anakanak ajar tatap muka ptm sekolah tenang kader partai demokrasi indonesia juang puan,1
perintah mengijinkan sekolah laksana ajar tatap muka jaga sehat anak pasti ikut tips soebat sehat,1
jadi teman jemput grabcar rumah bapak anak sekolah offline teman anak maaf eh suami antar teman kerja teman single,0
resah anak sekolah offline pengaruh bilang buruk siswa umur paut anak,-1
siswa sekolah dasar tengah ajar daring rumah senin juru bicara perintah beijing xu hejian,-1
bb rekomendasi moisturizer orang serum bagus kulit belang semenjak sekolah offline jidat sender belang banget,-1
saya angkat corona sekolah full tatap muka setahundua saya daring saya interaksi teman teman kelas chat kebanyakantapi rela pisah sekolah tengah juru saya smkyadikamdo warna,0
prefer uji daring sekolah orang uji offline pakai kertas sekolah,0
alhamdulillah banget syukur ptm laku ajar senang anak sekolah offline,1
sekolah tatap muka terima sabtu libur,0
gila seperti saya sekolah offline,-1
sekolah offline google classroom tugas,0
aaaaa sekolah offline saya full,-1
iya sekolah mbak offline sklhnya,0
bagus pagi semangat pat daftar ppdb sekolah offlineonline wish luck and have a great monday,1
woiii besok saya sekolah tatap muka degan banget,-1
libur sekolahhhh akhirnyaaa les libur lega emak pikir kerja rumah google meet zoom google classroom absensi isi borang skrining daring ptmt moga next academic offline masuk sekolah fulllll,1
sksksks pikir kuliah offline gmnaa saya tinggal rumah emak buru buru sekolah sekolah beda kota suap huhu,0
negeri sulawesi selatan ppdb offline,0
konspirasi weh habis covid terbit cacar monyet gejala huhu sekolah offline weh capek ngang ngong ngang ngong ett waspada gengs colong,-1
panic attack kambuh pas sekolah offline ngelampiasinnya buku oke repot orang,-1
sekolah kuliah offline pas butter daring,0
tani jaman sekolah offline daring butuh nge tingkat yuk ikut challenge,0
nder sekolah offline kerja rumah beda kurang menfess kayak kasih semangat streaming jadi beban,1
sekolah offline ajar sempoa kangen murid hebat hhehe,1
puan syukur indonesia pasuk fase endemi covid kondisi anakanak ajar tatap muka ptm sekolah tenang puan peduli tani,1
ikut sedih lucu kondisi bocah jalan hidup sekolah tatap muka teman ajak tantang truk teman,0
offline kemarin corona marak sekolah mau offline,1
aduh jumat sekolah offline ku usahain premier,-1
sebentar banget bukti kelas takut banget masuk sekolah banget masuk offline kelas,1
saya diet sekolah offline,-1
terima sakit hati suka wkwk aneh janani pikir ku suka semester kelas sekolah offline pikir ketemu,0
oh oke oke pikir ulang offline sekolah,0
puan syukur indonesia pasuk fase endemi covid kondisi anakanak ajar tatap muka ptm sekolah tenang puan peduli orang cilik,1
maksud kuliah kerja sekolah offline urus sibuk,-1
daring store nder offline store jual kayak toko lengkap pramuka pas jaman sekolah beli sepatu lomba paskib,0
kaji kesiap wacana sekolah tatap muka partai adil sejahtera jawa timur gelar webinar via,0
puan syukur indonesia pasuk fase endemi covid kondisi anakanak ajar tatap muka ptm sekolah tenang puan peduli layan,1
ppdb sekolah dasar yoyakarta buka sistem rto daring offline simak syarat daftar daftar sekolah dasar ppdb rto yoyakarta,0
sekolah offline seru milik teman mudah erti banding daring,1
sebentar doang sekolah offline ngangong,1
loml iyaudh offline pulang sekolah,1
christyjkt selamat enjel semangat enak sekolah offline,1
pusing pilih tas sekolah beli daring offline,0
hasil antigen minggu susah dad syarat masuk anak kelas offline wajib tes lab boleh tes mandiri murah jalan masuk sekolah jarang improvement ada,1
gubernur jawa timur khofifah indar parawansa kabar kabupatenkota jawa timur masuk status ppkm level giat laksana tatap muka ptm sekolah gelar persen,1
semangattt sekolah offline ulngn,1
hidup normal hadap macet sekolah kuliah ngantor laksana tatap muka,1
wkwk saya introvert semangat sekolah offline sosialisasi ilmu nomor,1
sekolah offline,1
mem driverny kurang kayakny anak sekolah full offline habis saya lihat pagi mzr kayakny gojek banget antar siswa sekolah,1
sekolah tertawa hihi uji semester offline,0
urus siswa anak medot sekolah alas suka ajar jarak jauh ingin ptm gilir ptm mau medot medot alas nyaman giat ajar ajar offline mau ajar jarak jauh sambi main game daring,0
temanteman kerja sekolah kuliah offline please pakai masker jaga sehat bersih hepatitis akut,-1
sekolah wilayah jabar aju giat ajar ajar tatap muka dukung maju nusantara,1
puan syukur indonesia pasuk fase endemi covid kondisi anakanak ajar tatap muka ptm sekolah tenang puan solusi bangsa,1
saya cello helga paket rumah saya sekolah offline pindah kota paket kirim saya senang banget buka paket wrwrwrwr,1
jangaaaan anak gakjadi sekolah offline bayar mahal,1
sekolah offline jdwal sekolah tugas tumpuk close free open fast resp jadwal open ambil mana free nder,0
puan syukur indonesia pasuk fase endemi covid kondisi anakanak ajar tatap muka ptm sekolah tenang kader partai demokrasi indonesia juang puan,1
kahskshsj sekolah offline sebal,-1
puan syukur indonesia pasuk fase endemi covid kondisi anakanak ajar tatap muka ptm sekolah tenang kader partai demokrasi indonesia juang puan,1
part pulang kampung gara gara sekolah offline,-1
heran apaapa takut takut takut takut ppak cuuuyy kuliah offline kayak sekolah ruang normalisasi,-1
today situation juggling kerja urus sekolah kakak offline riwa riwi the other partij siap world tour the other partij,0
saya pikir teman teman gara gara sekolah offline uji pas butter serba daring,0
yay saya offline soalnyy kemarin teman saya studytour bawa itu seperti paketny langsung kirim sekolah saya boarding erti gara gara lempar banting kamera pakai,0
semangat christyjkt sekolah sekolah offline by the way sore giat,0
tertawa besok saya benar wisuda aduh saya isi daring ketimbang tatap muka sekolah jujur,1
nder offline biasa bekal sekolah,1
anak sekolah aktif offline macet parah banget plizz,-1
puan syukur indonesia pasuk fase endemi covid kondisi anakanak ajar tatap muka ptm sekolah tenang kader partai demokrasi indonesia juang puan,1
pantau minggu sekolah offline full day tangan ombre,-1
pulang sekolah ajak tatap muka dua kelas anak anak masalah sadar salah sadar orang tua peduli sayang hilang semangat ajar faktor,0
sekolahkuliah offline cung,1
gcfs sekian sekolah tatap muka kelas tarik tuju,1
sekolah offline,1
minggu minggu pandemi minggu normal kuliah offline kerja kayak anak sekolah masuk handphone daring rasa masa,1
wkwk buna mah adik al sekolah offline bun,0
tolong deh anak girang pagi tenang sekolah tatap muka normal jalan,1
pandemi reda sekolah offline deh sulit adaptasiin fisik mental loyo santai santai,-1
puan syukur indonesia pasuk fase endemi covid kondisi anakanak ajar tatap muka ptm sekolah tenang kader partai demokrasi indonesia juang puan,1
sekolah offline full capai,-1
waspadacacarmonyet aduh ampun konspirasi weh habis covid terbit cacar monyet gejala huhu sekolah offline weh capek,-1
santai jam sekolah daring enak offline bolak,-1
puan syukur indonesia pasuk fase endemi covid kondisi anakanak ajar tatap muka ptm sekolah tenang kader partai demokrasi indonesia juang puan,1
puan syukur indonesia pasuk fase endemi covid kondisi anakanak ajar tatap muka ptm sekolah tenang kader partai demokrasi indonesia juang puan,1
mplsacara sekolah offline,0
pas daring uji sekolah ku make quizizz offline make quizizz,0
puan syukur indonesia pasuk fase endemi covid kondisi anakanak ajar tatap muka ptm sekolah tenang puan peduli tani,1
sekolah offline tugas video presentasi,0
anjing sekolah wisuda offline jalan jalan bal,-1
kakak kelas nder pasti sekolah offline jaman daring jomlo,1
christyjkt pagi njel semangat sekolah offline,1
efek sekolah offline pintar,-1
sekolah offline,-1
konspirasi weh habis covid terbit cacar monyet gejala huhu sekolah offline weh capek ngang ngong ngang ngong ett waspada gengs colong,-1
kelas asa banget circlean circle nimbrung bareng kangen kemarin potong pandemi coveed suka sedih bayang pas sekolah offline,1
puan syukur indonesia pasuk fase endemi covid kondisi anakanak ajar tatap muka ptm sekolah tenang puan peduli tani,1
kerja sekolah kuliah offline rumah aktivitas pakai masker jaga sehat hepatitis akut,-1
fmr surabaya ajak kawan capai sosialisme ikut sekolah politik hari sekolah offline,0
asyik banget sekolah offline,1
bebas buka masker tempat sepi sekolah offline eh muncul,1
puan syukur indonesia pasuk fase endemi covid kondisi anakanak ajar tatap muka ptm sekolah tenang kader partai demokrasi indonesia juang puan,1
haloo kakak sekolah ada pensi offline gs the overtunes minatt banget click link kak,1
saran saya nder sekolah langsung verifikasi data manua saya siang daftar senin accord daftar offline langsung hijau kasih kertas daftar,0
puan syukur indonesia pasuk fase endemi covid kondisi anakanak ajar tatap muka ptm sekolah tenang puan peduli orang cilik,1
main bola futsal les bilang alih baik darimg sadar sekolah offline kaget sebelumny pikir daring lulus,0
sekolah offline sebentar kenang,1
wkwk anjing saya keluar keluh kesah sekolah saya doang uji offline pakai kertas ljk jujur sekolah daring masuk otak maaf banget shock pakai ljk,-1
sekolah international internasional kurikulum bla bla bla periksa alternatif sekolah rasa kurikulum sekolah anak saya blended learning offlineonline,0
adil sekolah daring offline susah banget jujurly nyaman daring,-1
i hope everything gets better sekolah offline sedih hilang,1
puan syukur indonesia pasuk fase endemi covid kondisi anakanak ajar tatap muka ptm sekolah tenang puan peduli tani,1
susah naik durasi menit durasi pengaruh views army anggur jaman dynamite butter cepat banget work from home sekolah daring offline,0
dom daring berangkat sekolah sekolah pakai kertas offline,1
kemarin pas kakak perempuan wina bandung suami semangat kerja deh orangorang libur bandung yoyakarta singapura sadar libur anak sekolah offline piraku sakola liburannnn,0
pat offline sekolah pasrah nilai na menang,-1
merekaaa kayak lihat kangen sekolah offline aduh,1
anjing coy sekolah offline kelas wifi alias kelas saya,-1
syukur iya minggu pat besok beres aman habis giat sekolah onlineoffline,0
puan syukur indonesia pasuk fase endemi covid kondisi anakanak ajar tatap muka ptm sekolah tenang puan peduli orang cilik,1
kangen sekolah offline alskslslsl,1
bisabisanya sekolah pisah offline sekolah ku daring sedih daring tt,0
puan syukur indonesia pasuk fase endemi covid kondisi anakanak ajar tatap muka ptm sekolah tenang kader partai demokrasi indonesia juang puan,1
sekolah offline full capai,-1
cek jadwal syarat daftar ppdb yoyakarta non rto ppdb offline yoyakarta lengkap jalur buka via detikedu,0
sekolah full tatap muka yuk siap makan halal thoyyib untukananda,1
puan syukur indonesia pasuk fase endemi covid kondisi anakanak ajar tatap muka ptm sekolah tenang kader partai demokrasi indonesia juang puan,1
puan syukur indonesia pasuk fase endemi covid kondisi anakanak ajar tatap muka ptm sekolah tenang puan peduli tani,1
pindih sekolah ku offline,1
sekolahkuliah offline mandi siang kali,0
kasihan murid saya dibolehin orang tua sekolah offline stay rumah kelas daring,1
puan syukur indonesia pasuk fase endemi covid kondisi anakanak ajar tatap muka ptm sekolah tenang puan peduli tani,1
christyjkt semangat sekolah offline sulit,1
