tweet_bersih,label_sentimen,label_prediksi
sekolah offline pas berangkat hujan pulang motor mogok jalan kaki siang bolongpake pantofel,1,positif
sekolah daring offline,0,netral
pensi kook ngurangin koleksi habis sekolah offline takut gadirawat pcku,-1,negatif
kayak rest hunter sekolah offline,1,positif
lebih baik offline deh sekolah daring pusing banget saya,1,positif
sekolah offline sesi sesi pagi siang sesi siang sore,1,positif
kelas kelas sekolah offline parkir,1,positif
sekolah daring keluh sekolah offline keluh,0,netral
offline school capek anjing fisik saya capek banget sekolah kelas maksimal,-1,negatif
proses pindah on ingin sekolah offline full day canda teman cepat banget lupa sakit,1,positif
saya sekolah offline ajar pedicure and manicure saya sekolah tumpang sih kuku lumayan gratis,1,positif
banget pas sekolah offline jalan pulang tongkrong warung jadi tongkrong anak sekolah khusus sekolah untung pakai motor,1,positif
gapapaa mulung semangat sekolah seru banget offline,1,positif
frio alas terima orang cari teman kayak coba sudut pandang tempat kuliahsekolah kena pembullyan apa rugi senang daring offline,-1,negatif
sisi try hard baur pas kuliah coba cari teman minat orang kayak bantu teman susah tugas teman djadiin alas sekolah offline gede susah cari teman imo,0,netral
cepat sekolah offline,1,positif
pas sekolah daring buru kayak sekolah tatap muka offline pas sekolah offline sekolah daring,0,netral
saya pas sekolah offline,1,positif
iya karr mingdep saya sekolah offline saya jakarta libur,0,positif
pas sekolah offline hafal jadwal ajar hafal,1,positif
sekolah offline diksi duit jajan,-1,negatif
sch offline offline sekolah pas kelas kelas sender gedung sender cepat kelas,1,positif
sekolah offline capek rasa wkwk sore les moga cepat adaptasi eh betah banget sekolah sore banget jam sore pulang,-1,negatif
sekolahkerja via daring enak begadang bangun siang khawatir berangkat kerjasekolah offline gedandapan puyeng,-1,negatif
ke uang jajan uang bensin kadang suka tambah ke kakek main rumah pas jaman offline kos perlu sekolah kayak fotokopi kasih,0,netral
wow mantap by the way dom cepat sekolah offline pagi sore,1,positif
sekolah offline pagi sore kah,0,netral
sekolah offline tugas banget lumayan jarang on twit hbu,-1,negatif
sekolah offline tugas banget hssj,-1,negatif
sayang syukur orang gilir daring ingin offline sekolah offline ingin daring mau konsisten lebih baik sekolah deh,0,netral
sekolah offline,0,netral
sayang syukur orang gilir daring ingin offline sekolah offline ingin daring lebih baik sekolah deh kesal,0,netral
alhamdulillah jalan sekolah offline kasih sangu orang tua jatah ke hari tabung alhamdulillah jalan album sn kumpul ambil beli jilbab kumpul ke,1,positif
jumat sekolah offline,1,positif
i mean like skip kelas masuk sekolah offline,1,positif
sibuk urus sekolah offline tugas banyak,-1,negatif
apa sekolah offline,1,positif
sekolah offline susah on im sowrrryyyy,0,netral
halo tai sekolah daring masuk offline by the way lupa makan,0,netral
schapp sekolah offline tugas trivia ombrometer alat ukur curah hujan,0,netral
pas offline kasih ongkos pulang doang kantin sekolah buka wkwk,0,netral
cug bersukurnya manusia kasih libur keluh rasa hidup normal sekolah offline hidup normal sekolah offline eh daring,0,netral
capek sekolah offline,-1,negatif
sekolah daring offline,0,netral
nder nadiem pusing sekolah daring salah sekolah offline salah beliau pusing,0,netral
sekolah offline jam capek banget,-1,negatif
senin buruk sekolah offline terima kasih isi x ilmu tahu alam obrol lihat liat,1,positif
saya mingdep offline terima kasih jam sekolah saya selasela ajar bu izin angkat video call lia,1,positif
banget sekolah offline pas dengar kabar ajar offline senang pas offline daring suasana freak,-1,negatif
bleau sekolah offline hbu,1,positif
iya diksih semenjak masuk sekolah offline,1,positif
bismillah gedor makji kumpul duit makji bayar utang mama tunggu rezeki tambah beli novel alat sekolah adik offline,1,positif
kantin sekolah sekolah offline buka,0,netral
todays mail kali todays mail pc hand sanitizer renjun sekolah offline anjaylucu banget pas datengnyasafe packing and another yupi for freebies,0,netral
sekolah offline batas,1,positif
sibuk diri chil sekolah offline unjung sekolah langsungtetep on kadang malam,1,positif
iya ibu sekolah offline,-1,negatif
sekolah offline full deh tt,1,positif
kantor sekolah masuk offline pusiang bu moga jadi,-1,negatif
syukur daring egois saya syukur banget offline pekan adik saya paham kalian dikitdikit tolong erti sekolah kasih surat ketidaksiapan offline,1,positif
adik masuk sekolah offline,1,positif
sekolah rumah offline sembunyi rumah,1,positif
cieee sekolah offline,1,positif
sekolah offline daring sesuai suasana hati,0,netral
gemas banget ponakan sekolah offline,1,positif
heboh kerja anak sekolah offline,1,positif
antuk sekolah offline,-1,negatif
sekolah offline kh,0,netral
sumpah sekolah offline sanguu,1,positif
offline class kayak sekolah enak anjr obrol saya istirahat ajar pulang obrol teman duduk jauh kayak orang budek obrol dah offline,-1,negatif
sekolah offline,0,netral
aii seru sekolah offline,1,positif
enak sekolah offline kemarin pas saya ngambilin raport adik flashback sekolah seru banget woeeeee sempat,1,positif
heran lihat anak sekolah sekolah pakai masker keluyur sekolah offline anggap wkwk covid selesai salah ikut prokes sementang atur longgar,-1,positif
saya sekolah offline daring ahhhhh,0,netral
sumpah pas sekolah offline tumpuk woi tugas,-1,negatif
daring study offline exam hebat banget sekolah saya,0,netral
kasih daring offline siang malam sekolah meninggoy,0,netral
kak sekolah offline,1,positif
reply sekolah offline,1,positif
jujur capek banget sekolah offline,-1,negatif
pas sekolah offline kantin te jus ke,1,positif
kelas sekolah offline kah,0,netral
sekolah kah daring offline,0,netral
kayak indonesia normal wacana sekolah sore suka syukur banget suka giat daring alias lulus coy deg degan saya sidang skripsi offline,-1,negatif
saya semangat sekolah offline mnyesal,-1,positif
sekolah offline anjing,-1,negatif
anjing sekolah offline capek banget,-1,negatif
kuliahsekolah offline ajar nyala lampur kamar,0,netral
offline kayak buang buang ku pakai tugas sekolah guru masuk materi gkpp guru kasih tugas doang kadang guru jam mata ajar beliau pakai bahas tatib,-1,negatif
pagi makjii sekolah offline,1,positif
jujur iya anjing sekolah ku offline daring,0,netral
dak jujur enak anjing sekolah offline,-1,negatif
beli permen birutdi bingung beli permen biru bubblegum permen biru favku sekolah offline allah kangen jajan sekolah,1,positif
sekolah offline,0,netral
sch sekolah sender harlah offline sayang unggah foto tt,1,positif
diijinin sekolah offline alas kenapaaa,0,netral
benar sekolah sumber sebar sakit yasejak sekolah offline anak kena batpilpdhl ganti dokter gara batpil,-1,negatif
saya offline betah capek bolak sekolah capek rumah,1,positif
gess lepas aktif tepat sekolah offline asramaahayyyy yaaahh translate jametnya,1,positif
gess lepas aktif tepat sekolah offline asramaahayyyy yaaahh translate jametnya,1,positif
bangun pagi pergi kamar adik sekolah offline pergi rumah tante duo monyet rumah teman pagi bosan ganggu ganggu mama kebun marah,1,positif
beli sekolah offline baterai boros banget,1,positif
kurang sekolah offline sakit pinggang cug capek duduk melulu,-1,negatif
gess lepas aktif tepat sekolah offline asramaahayyyy yaaahh translate jametnya,1,positif
askrl spill outer bagus seragam sekolah offline,1,positif
sekolah offline istirahat sebentar banget bekal saya habis bawaa,-1,negatif
cimory sekolah offline pulang,0,netral
saya sekolah daring saya offline berani sumpah daring saya kayak takut sosial saya diri ubah erti,1,positif
lulus c word sekolah offline,1,positif
malas gerak banget anjing sekolah offline,-1,negatif
adik saya sekolah offline saya rumah kuliah nanti sore asa anggur anjing,-1,negatif
daring sekolah daring ptm ajar tatap muka offline kamu kuliah kh liar,0,netral
saya banget sekolahmana kelas saya ganti wifi sekolah sad banget buka galeri atauga main game offline,-1,negatif
sekolah offline jam gerah banget anjing nyala ac,-1,negatif
sekolah offline asa latih militer,-1,positif
sekolah offline bawaanya panic attack bagus daring tenang,-1,negatif
iya nder kynya sekolah offline,1,positif
jujur pas saya potong corona daring enak daring enak offline benar rasa banget sekolah kenang deh saya anjing rasa agit,1,positif
masuk sekolah offline,1,positif
iya kak expo universitas bimbel jadwal sekolah expo offline sekolah join zoom,0,netral
dua daring ringan materi kepala cari materi ajar offline berat materi masuk otak capek pulang sekolah muka pucet,0,netral
sekolah daring offline,0,netral
untung daring offline korban bullyan fan mu sekolah,-1,negatif
hai moots sekolahkuliah offline kampus praktikum,0,netral
sekolah offline,0,netral
sekolah offline jam berangkat jam bangunlagi bisa bangun jam tidur lagihadeh tolol banget dhuntung lambat,-1,negatif
malas banget sekolah offline,-1,negatif
christyjkt sekolah offline tinggal bus sekolah,0,netral
nggasoalnya jawalnya sekolah offline,1,positif
pagi semuaaaku sekolah offline todaykalian gmndaringoffline,0,netral
kesini malas sekolah offline anjing,-1,negatif
saya sekolah offline,1,positif
sekolah offline,0,netral
fr sekolah saya banget anyink dibotakin lebih baik offline,1,positif
sekolah offline daring adab,1,netral
dengar sekolah offline langsung tenang hati,-1,negatif
oi sekolah offline yyy wkwk,1,positif
sekolah but offline,0,positif
close siangg sekolah offline,-1,negatif
offline semangat sekolah offline,1,positif
campur kayak sekolah minggu kali offline sesuai jadwal campur daring mata ajar rasa juru kayak pkn sunda offline fokus mata ajar kayak matematika mata ajar juru,1,positif
jadwal bestie sekolah offline asyik,1,positif
kapann sekolah offline,1,positif
gilir daring offline pas offline daring sekolah yuk yuk,0,netral
sekolah offline,0,netral
sekolah offline day jam kosong,1,positif
tanyarl risih teman bicara konteks sekolah adakan giat giat beda murid pilih acara wajib offline sekolah daring,0,netral
sekolah daring offline by the way sarap,0,netral
sekolah daring offline by the way sarap,0,netral
sekolah offline tugas video another level of pain,-1,negatif
sekolah offline daring,0,netral
sekolah offline daring,0,netral
banget anjing nolep gpunya teman seko sekolah offline pusing banget jujur,-1,negatif
semangat guru letak hadir murid sekolah sehapalagi semenjak pandemi paksa sekolah daring perlahan offline semangat ajar langsung lipat ganda ku,1,positif
sekolah offline daring,0,netral
sekolah offline seru bayangkann,-1,positif
moga sekolah offline,1,positif
hlow sekolah offline semangat,1,positif
offline daring sekolah e nanti saya bantu alas tau offline,0,netral
p the sekolah offline,0,netral
sekolah offline aaaaaa kali kelas tertawa pamer,1,positif
agree jujur sekolah offline enak saya,-1,negatif
sekolah daring offline,0,netral
sekolah offline sakit jdinya daring,-1,negatif
eh sekolah offline jam,0,netral
kamu sekolah offline daring,0,netral
sekolah offline tarik oh,-1,negatif
semangat ptm sekolah offline sesi siang,1,positif
mootssss sekolah daring offline,0,netral
sekolah offline,0,netral
sekolah offline panas,-1,negatif
oh besok sekolah offline semangat sekolah,1,positif
sekolah offline guru moga jam kosong wkwk,1,positif
bangun sekolah offline,-1,positif
tanggal desember bangtan konser offline saya sekolah offline tai,-1,negatif
sekolah daring offline,0,netral
morningdari sekolah offline,1,positif
dyaz sarap sekolah offline have a nice day too dyaz,1,positif
sekolah offline kah,0,netral
class meet offline po korban lomba po lomba class meet sekolah ku sekolah iya sayang,0,netral
kali sekolah offline,1,positif
sekolah daring offline by the way sarap,0,netral
lxyc sekolah daring offline by the way sarap,0,netral
sekolah daring offline by the way sarap,0,netral
sekolah daring offline by the way sarap,0,netral
pagiii sekolah offline semangat,1,positif
sekolah daring offline by the way sarap,0,netral
sekolah daring offline by the way sarap,0,netral
mndhs kesekolahh kim sekolah offline daring paman,0,netral
haloo rinn aksksusjsns allah kabarnyaaa dhh sarap lummm sekolah daring offline kuliah kerja apa semangat rinnn,0,netral
rina hyonk kamu sekolah offline,0,netral
malas sekolah offline kayak orang,-1,negatif
semangat banget sekolah offline,1,positif
sekolah offline daring,0,netral
anjing besok sekolah offline,-1,negatif
sch malas banget senin sekolah offline,-1,negatif
semangat sekolah offline adik,1,positif
ajar jarak jauh semangat sekolah offline,1,positif
agy sekolah offline,1,positif
malas malesan lebih baik bdr dim rasa jenuh seru lebih baik sekolah offline,1,positif
aaaaa sekolah offline,1,positif
iya kuat nek sekolah offline,-1,negatif
sekolah offline pulang jam,0,netral
sekolah offline daring,0,netral
selamat pagi sekolah offline aduh,-1,negatif
offline sekolah siang,1,positif
punyaa jaman sekolah offline make lagu alarm,1,positif
sekolah offline guru ganteng tukang ayam bakar,1,positif
pagiii semangat sekolah offline deg deg an,1,positif
iya saya sekolah offline,1,positif
pagiiii sekolah offline degan banget plisss,-1,negatif
aw sekolah offline,1,positif
pagi moots sekolah offline semangat daring tidur,1,positif
unty morining kak fen sekolah offline,1,positif
pagiii sekolah offline semangat,1,positif
sekolah offline kak pulang jam les jam wahwah,-1,negatif
semangat sekolah offline,1,positif
first time sekolah offline jujur asyik kakel,1,positif
sekolah daring ingin offline pas kasih offline malas malesan dasar,-1,negatif
iya saya minggu les sekolah offline isi,0,netral
beli sekolah offline,1,positif
sekolah offline,0,netral
sekolah offline batal saya capek banget anjing offline ngabisin bensin kuota,-1,negatif
pagi moots by the way sekolah offline daring semangat,1,netral
struggle kira daring offline enak bangun jam tau berangkat sekolah wkwk balik imbang,0,netral
sekolah offline,0,netral
good pagi sekolah kelas offline kenal kelas pain,1,positif
sekolah offline,0,netral
sekolah offline,0,netral
sekolah offline,0,netral
yusuf mansyur too sekolah offline pts saya,1,positif
sekolah offline,0,netral
sekolah offline,0,netral
ih teman teman sekolah offline keren,1,positif
sekolah offline,0,netral
adik jiwa malesnya sekolah offline hiks paksa lawan main fisik,-1,negatif
sekolah offline,0,netral
malas malesan sekolah offline,-1,negatif
pagi teman sekolah offline,1,positif
good pagi moots sekolah offline hdue pusing gara gara bawa flu by the way lupa makan,-1,positif
iya allah lupa jam offline mau apa sekolah ku rumah oke mandi,0,netral
selamat saya sekolah offline doa iya moga guru tagih tugas,-1,negatif
wish me luck sekolah offline saya kenal,-1,negatif
oh adik saya jaksel sekolah offline,1,positif
huaa moga cepat sekolah offline,1,positif
syukur sekolah offline,1,positif
schdkfks sekolah offline,1,positif
sch kangen sekolah offline sesi sesi an trivia rumus harga imbang pasar qdqs,1,positif
sch teman teman pas sekolah offline hilang barang sharing dong trivia stratifikasi bagi stratifikasi buka tutup campur,0,netral
sekolah offline,0,netral
anjing masuk minggu sekolah offline,-1,negatif
adik sekolah offline owowoow takut sekolah offline handphone ku selesai,-1,negatif
unty pagi sekolah offline,1,positif
sekolah offline and do know pren saya lupa make dasi ueueue,-1,negatif
salamat pagisemangat sekolah offlineyang semangat,1,positif
masuk sekolah offline hiksssrothh malas,-1,negatif
malas gerak banget sekolah offline,-1,negatif
sekolah offline daring,0,netral
sekolah offline lupaa sarap,1,positif
sekolah offline daring,0,netral
ow hore sekolah offline,1,positif
sekolah offline hore,1,positif
sumpah saya malas sekolah offline,-1,negatif
sekolah offline,0,netral
antuk sekolah offline,-1,negatif
sekolah offline,0,netral
sekolah offline adik adik,1,positif
saya sekolah offline taejin live semangat,1,positif
pagi selamat saya on the way sekolah offline hufttt,-1,negatif
ah shitt sesal banget sekolah offline enak sekolah daring,-1,negatif
aduh sekolah offline,-1,negatif
bye bestie sekolah offline,1,positif
tidak sekolah offline pagi,-1,negatif
sch sekolah offline jadwal ajar ganti ganti diumumin jadwal baru h harijam,0,netral
uh rumah biasa interaksi orang keluarga rumah moga sekolah offline buruk takut banget tolong,-1,negatif
tidurrr perkara saya sekolah offline tugas ekonomi tuntassss syalann battttt,-1,negatif
sekolah daring offline,0,netral
enak sekolah offline meeting daring,1,positif
saya selesai jam deh pagi saya sekolah offline,-1,negatif
sekolah offline,0,netral
class i sekolah offline but i grup a sok this week study je kot,-1,negatif
besok sekolah offline saya henti salah tingkah crush saya kelas besok ajak obrol bicara tertawa,1,positif
pas sekolah offline tidur,0,netral
besok sekolah offline gabiss tidur,0,positif
tidur saya oh saya habis minum kopi besok sekolah offline siang lucu,-1,negatif
sekolah offline jam tidur ku langsung rapi banget,1,positif
besok masuk sekolah offline moga pulang sekolah pas buka twitter langsung selamat amin,1,positif
hai habis gratis sms kabar jumpa maksud apa heran bicara gratis sms gacukup hari gratis telpon jam sekolah offline,0,netral
lihat jadwal sekolah offline senin pulang jam siang aaaaa,-1,negatif
sekolah offline butuh,0,netral
malas sekolah offline iya,-1,negatif
jarang pakai gerak cepat offline kumpul sekolah,1,positif
besok sekolah offline seragam saya ember alias air rendam,0,netral
pakai google classroom nder alias sekolah full offline,1,positif
h sekolah offline,0,netral
bayang sekolah offline nasib fan mu sekolah besok senin,-1,negatif
besok sekolah offline kumpul lanjur pagi,-1,positif
habis sekolah offline jujur saya benar pakai sesi an saya mental minggu,-1,negatif
besok saya sekolah offline malas,-1,negatif
besok saya sekolah offline malas gerak banget,-1,negatif
omgg besok sekolah offline,-1,positif
lebih baik tidur besok pagi sekolah offline antuk antuk kelas,-1,positif
sekolah offline vaksin here we go,-1,negatif
ra bayangke dadi rafi rabbanisesok sekolah offline andang ece koncone,1,positif
tidur besok sekolah offline,1,positif
sadar besok saya sekolah offline aaaa,-1,negatif
tanyarl besok sekolah offline huhu mandi pagi sender besok apalan kimia,-1,negatif
besok saya sekolah offline,1,positif
sumpah sekolah offline stres,-1,negatif
fisika fuck banget erti guru masuk minggu ngejelasinnya detail eh kasih ulang anjing sekolah offline kit heart kali nilai rendah,-1,negatif
eh laaahh malas banget sekolah offline saya semangat,-1,negatif
oh iya besok sekolah offline teel sepi banget,1,positif
sekolah offline,0,netral
jam gin degdegan ngehadapin senin besok pikir pikir sekolah daring santai mandi mandi sarap tinggal dapur bawa kamar jam potong pas jaman offline,-1,negatif
guru gjls jadwal jam gin besok sekolah offline,-1,negatif
umm teman besok pertama sekolah offline murid belum teman cheer me up takut banget teman,-1,negatif
arus gede banget busett heran bakar kabel parallel tengah hilang coba untung coba offline hangus sekolah,0,netral
kerja daring minor kelas offline kerja offline langsung bentrok sekolah tugas les,0,netral
malam saya coba ambil tidur pas pagi langsung sekolah offline,-1,negatif
members kak besok sekolah offline,-1,positif
pas sekolah offline,1,positif
lucu banget lihat anak remaja exciting besok sekolah offline,1,positif
wkwkkwkwwk nolep banget saya sekolah offline,1,positif
sekolah anya lucu banget offline bulan,1,positif
miskin sekolah offline uang jajan wkwk,-1,positif
sekolah offline malas bangun pagi,-1,negatif
besok sekolah daring offline,0,netral
besok sekolah offline,-1,positif
ngespace yuk eh besok sekolah offline sekolah offline wkwk,-1,positif
besok sekolah offline foto ijazah deh jadwal foto ijazah pagi muka ubah ladang minyak,1,positif
tidur besok sekolah offline,1,positif
besok adik sekolah offline,1,positif
hai besok sekolah offline daring,0,netral
besok sekolah offline mules rn,1,positif
pas offline bangun tidur ku mandi daring bangun tidur langsung sekolah,0,netral
ngedudel besok stres sekolah offline deadline commission,-1,negatif
pagi bantu masak tahlil mama ayah siang zoom angkat jemur sapu ngepel sore pergi nobat pas pulang tonton bareng bantu beres beres rumah nenek besok pagi cuci baju gunung adik besok sekolah offline,1,positif
official besok sekolah offline,1,positif
via cerita iya iya cepat dahlahhh ah gaseru anjing lambat bingung curhat nct kayak enakkkk pas sekolah offline cerita sambung chairmate mianhae via,1,positif
besok sekolah offline,1,positif
semangat fayy besok sekolah offline kyu titip salam kangen,1,positif
sekolah offline paling capek punggung capek pikir layar capek olahraga pacar antuk kayak bangun kasur tenaga mata berat banget tidur,-1,negatif
besok sekolah offline,1,positif
malas banget besok saya sekolah offline,-1,negatif
by the way besok sekolah offline,1,netral
pas sekolah ke minggu subsidi uang jajan sekolah ke tertawa kuliah offline bulan moga pas offline subsidi uang jajan minggu ke kuota ke,0,netral
tertawa minggu kemarin offline plus sabtu ekskul capek banget lupa sekolah offline,-1,negatif
besok gilir saya sekolah offline tugas minggu selesai saya ngantukann point nomor,0,negatif
kangen sekolah offline kayak sakit tryout akbar sekolah tertawa,1,positif
besok sekolah offline,1,positif
sekolah offline selang seling,0,netral
sekolah offline,0,netral
sekolah kuliah offline,0,netral
anjing besok sekolah offline ajggg,-1,negatif
saya besok sekolah daring dar minggu doang saya offline,0,netral
saya tidur duluaan moots besok sekolah offline bangun pagi good night mootss,1,positif
sp besok sekolah offline cung,1,positif
alhamdulillah semenjak sekolah offline rumah scroll lini tertawa,1,positif
maksud sekolah rumah sekolahttp offline nomer daring masuk kuping kanan kuping kiri blmmm foto amuro pakai baju kid anime manga dc rilis volume,1,positif
beli daring streaming mulai jumat jam jam jam sekolah sekolah kena jadwal offline hadu,-1,negatif
prefer sekolah daring offline,0,netral
sekolah daring offline enak acara,0,netral
besok saya sekolah offline,1,positif
aduh offline malas gerak banget saya besok sekolah ih,-1,negatif
iya sekolah offline,1,positif
sekolah offline bestie daring,0,netral
suka sekolah offline daring,0,netral
sekolah offline ulang daring,1,positif
harap sekolah offline semangat ajar malak duit orang tua,1,positif
capek banget buset sekolahkuliah offline ketemu terbit benam matahari,-1,negatif
besok offline kayak sekolah ku lambat offline besok tertawa,1,positif
wkwkwkwkwkwk saya minggu kali only sekolah minggu hari ganti gkpp syukur offline,1,positif
konteks sekolah offline,1,positif
sekolah offline php,1,positif
bagus deh iyaanie sekolah ku offline tugas cecer aosksjsjshsh,-1,negatif
besokk sekolah offline daring bestiee,0,netral
besok jadwal sekolah offline,-1,negatif
besok sekolah daring offline,0,netral
sekolah offline aku nyaman sekolah daring,-1,netral
nder novdes daring sekolah ku murid offline,1,positif
sekolah offline anjing,-1,negatif
no offense efek anak sekolah offline taat prokes srba salah orang tua enak anak sekolah seko anak buka masker colek ingus,-1,positif
sering sekolah daring besok sekolah offline,1,positif
run run besok senin by the way sekolah offline,0,netral
besok senin sekolah offline huaaa,-1,negatif
staf bebudak cuti sem lepas spm sok member sekolah orang kerap sok serve ramah muncul soal manajer gay mintak top up juragan cakap offline,0,netral
capek sekolah offline,-1,negatif
bingung sekolah offline enak paham materi dijelasin langsung daring ajar duduk rebah gaya apa oncam,1,positif
twit hai kak yoon badmood banget gara tugas sekolah susah ampun malas sekolah tugas kerjain suka pikir malas sekolah offline masuk sekolah tengah juru,-1,negatif
suka sekolah daring offline,0,netral
aeh offline live stream time sekolah weh,0,netral
besok sekolah offline tolong akdgsksgsjs,-1,positif
besok sekolah offline diliburin,1,positif
besok sekolah offline,1,positif
allah besok sekolah offline,-1,positif
besok sekolah offline,1,positif
ih samakk sekolah offline gupek takut lupa,-1,negatif
woi besok sekolah offline anjing,-1,negatif
malas sekolah offline ketemu teman,-1,negatif
weyy sekolah offline shiftan saya ngehapus materiebook foto ajar handphone,1,positif
coronces nder daring murid atur kayak sekolah offline deh hasil,0,netral
aaaa besok gilir saya sekolah offline,-1,negatif
keren sekolah hybrid daring offline ajar efektif,-1,negatif
bes masuk sekolah offline rambut warnain marah kaget pas masuk guru marah suruh ganti warna hitam,1,positif
wkwk besok saya sekolah offline,1,positif
alhamdulillah semenjak sekolah offline kuota sedia,1,positif
gueee besok sekolah offline malas,-1,negatif
besok sekolah offline,1,positif
twit jimin takut banget sekolah offline besok,-1,negatif
nggaaa besok sekolah wawancara offline terima kasih lt,1,positif
anak sekolah offline,1,positif
iya anjing saya sekolah offline,-1,negatif
besok sekolah offline daring,0,netral
besok sekolah offline anjing,-1,negatif
sekolah offline ulang daring,0,positif
senin besok sekolah offline,0,positif
pagi sekolah offline sore lanjut daring,-1,negatif
sekolahoffline sekolah offline,1,positif
gara izin offline moga sekolah saya offline sem,1,positif
besok senin saya sekolah offline,-1,negatif
aaaaaaargh pas empat ptd on stage sekolah offline,-1,negatif
moga lekas sembuh inten offline sekolah offline,-1,negatif
bts untung besok saya offline offline saya sekolah linglung,-1,negatif
ponakan saya masuk sekolah offline oh my god,1,positif
waaaa besok sekolah offline,1,positif
saya rasa sekolah offline,0,netral
senang streaming offline konser sekolah hai ampun menang,-1,negatif
sekolah offline tugas saya numpukkkkkkkkkkkkkkk,-1,negatif
saya senang banget besok sekolah offline wkwk kali kelas masuk kelas misah,1,positif
besok sekolah offline sial,-1,negatif
allahaku sekolah offline pas ajar matematika,-1,negatif
